{
  "schemaVersion": 1,
  "colors": {
    "background": {
      "value": "#F7F3EC",
      "label": "生成り"
    },
    "surface": {
      "value": "#EDE6D9",
      "label": "ベージュ"
    },
    "text": {
      "value": "#2C2620",
      "label": "墨"
    },
    "textMuted": {
      "value": "#877D6E",
      "label": "薄墨"
    },
    "primary": {
      "value": "#2C2620",
      "label": "濃墨"
    },
    "accent": {
      "value": "#4C5A3F",
      "label": "抹茶"
    },
    "onDark": {
      "value": "#F7F3EC",
      "label": "白抜き"
    }
  },
  "fonts": {
    "heading": "shippori-mincho",
    "body": "zen-kaku-gothic-new",
    "accent": "eb-garamond"
  },
  "textStyles": {
    "pageTitle": {
      "font": "font:heading",
      "size": {
        "pc": 28,
        "sp": 20
      },
      "lineHeight": 1.5,
      "letterSpacing": 0.15,
      "weight": 500,
      "color": "theme:text"
    },
    "heading": {
      "font": "font:heading",
      "size": {
        "pc": 28,
        "sp": 20
      },
      "lineHeight": 1.4,
      "letterSpacing": 0.1,
      "weight": 500,
      "color": "theme:text"
    },
    "subheading": {
      "font": "font:heading",
      "size": {
        "pc": 24,
        "sp": 18
      },
      "lineHeight": 1.4,
      "letterSpacing": 0.1,
      "weight": 500,
      "color": "theme:text"
    },
    "body": {
      "font": "font:body",
      "size": {
        "pc": 16,
        "sp": 14
      },
      "lineHeight": 1.8,
      "color": "theme:text"
    },
    "caption": {
      "font": "font:body",
      "size": {
        "pc": 14,
        "sp": 13
      },
      "lineHeight": 1.7,
      "color": "theme:textMuted"
    }
  },
  "recentColors": [
    "#4C5A3F"
  ]
}
